{
  "format": "brickbuild-photos",
  "version": "0.2",
  "capture": {
    "reference": "标准凸点间距 8mm；未经过相机标定，角度为人工估计",
    "frontMarker": "绿色斜甲与白裙甲为 +z；从正面看黑侧甲为 -x、深红侧甲为 +x"
  },
  "photos": [
    {
      "id": "ref_1792833393092",
      "file": "新建文件夹/1792833393092.jpg",
      "kind": "exterior",
      "azimuth": 270,
      "elevation": 5,
      "width": 3060,
      "height": 4080,
      "state": "closed",
      "note": "黑侧甲平视；在绿色正面图中位于画面左侧，定义为 -x",
      "sha256": "267eca9ca4d5e95074927e5e490da95c3c39b8f63cd87f64b7771c1a6c72c44c"
    },
    {
      "id": "ref_1792833393126",
      "file": "新建文件夹/1792833393126.jpg",
      "kind": "bottom",
      "azimuth": 0,
      "elevation": -85,
      "width": 3060,
      "height": 4080,
      "state": "closed",
      "note": "底面：双足与多色夹杆接口",
      "sha256": "fb59418aaf0fd67bd53b56129bcb5a0add9ed33cb018913aba75c01354534807"
    },
    {
      "id": "ref_1792833393176",
      "file": "新建文件夹/1792833393176.jpg",
      "kind": "exterior",
      "azimuth": 0,
      "elevation": 88,
      "width": 3060,
      "height": 4080,
      "state": "closed",
      "note": "顶面，方位角仅为记录约定",
      "sha256": "72b389bc3f202242a8c47c9654ed0beee069f3bab9932ed06b0593a0c4940b51"
    },
    {
      "id": "ref_1792833393211",
      "file": "新建文件夹/1792833393211.jpg",
      "kind": "exterior",
      "azimuth": 180,
      "elevation": 5,
      "width": 3060,
      "height": 4080,
      "state": "closed",
      "note": "黄色斜甲、红棕胸甲、黑裙甲为背面",
      "sha256": "c38f429e58644c7c40b808226245d41754707d50771f5ebce49942aa9018d18b"
    },
    {
      "id": "ref_1792833393249",
      "file": "新建文件夹/1792833393249.jpg",
      "kind": "exterior",
      "azimuth": 90,
      "elevation": 5,
      "width": 3060,
      "height": 4080,
      "state": "closed",
      "note": "深红侧甲；在绿色正面图中位于画面右侧，定义为 +x",
      "sha256": "d3ec8b5027308cc6cbd1947cd7c4e2b1a8f79048eb6aef6408cce8481f1cb668"
    },
    {
      "id": "ref_1792833393279",
      "file": "新建文件夹/1792833393279.jpg",
      "kind": "exterior",
      "azimuth": 0,
      "elevation": 5,
      "width": 3060,
      "height": 4080,
      "state": "closed",
      "note": "绿色斜甲、浅灰胸甲、白裙甲为正面",
      "sha256": "f9f5a26a47b4286c7669bd074a67dd1b871f085d707892ccfa7fcb58d5266421"
    },
    {
      "id": "ref_1792833393309",
      "file": "新建文件夹/1792833393309.jpg",
      "kind": "exterior",
      "azimuth": 270,
      "elevation": 20,
      "width": 3060,
      "height": 4080,
      "state": "closed",
      "note": "黑侧甲微俯视；不能同时记为 +x 和 -x",
      "sha256": "7dc2740bf7fc34cff4387fc0a0e3f8cbf5f5945dfa85496942ebf2bc15240994"
    },
    {
      "id": "ref_1792833393334",
      "file": "新建文件夹/1792833393334.jpg",
      "kind": "exterior",
      "azimuth": 315,
      "elevation": 35,
      "width": 3060,
      "height": 4080,
      "state": "closed",
      "note": "绿色正面与黑色 -x 侧面",
      "sha256": "afca6452b3640ad2466b4df4a4c1bab96fc6dc8d768cdc36070efc7b6ccb2c20"
    },
    {
      "id": "ref_1792833393358",
      "file": "新建文件夹/1792833393358.jpg",
      "kind": "exterior",
      "azimuth": 135,
      "elevation": 35,
      "width": 3060,
      "height": 4080,
      "state": "closed",
      "note": "黄色背面与深红 +x 侧面",
      "sha256": "17ee247d08eb4c8f53406c59256925f0c86fd11fe29e6dbf8c3522e77f08c796"
    },
    {
      "id": "ref_1792833393382",
      "file": "新建文件夹/1792833393382.jpg",
      "kind": "exterior",
      "azimuth": 225,
      "elevation": 35,
      "width": 3060,
      "height": 4080,
      "state": "closed",
      "note": "黄色背面与黑色 -x 侧面",
      "sha256": "e3beef9d8881e5bc5b283e37b5f3fb178370b5a721bf0d42033056fedfbaafc6"
    },
    {
      "id": "ref_1792833393410",
      "file": "新建文件夹/1792833393410.jpg",
      "kind": "exterior",
      "azimuth": 45,
      "elevation": 35,
      "width": 3060,
      "height": 4080,
      "state": "closed",
      "note": "绿色正面与深红 +x 侧面",
      "sha256": "51fc4e71b64c83bb70551ba5b1f2f6902ce6ac80c59550e89983887f5f835322"
    },
    {
      "id": "ref_1792834079990",
      "file": "新建文件夹/1792834079990.jpg",
      "kind": "interior",
      "azimuth": 270,
      "elevation": 15,
      "width": 3072,
      "height": 4096,
      "state": "open",
      "note": "拆下黑侧甲与双足后的核心，角度估计",
      "sha256": "bd7dfb52f4ae32a985d5a06cc3419d8b4b8ea148c8988f315e2e79bb2ad19001"
    },
    {
      "id": "ref_1792834080053",
      "file": "新建文件夹/1792834080053.jpg",
      "kind": "module",
      "azimuth": 0,
      "elevation": 45,
      "width": 4096,
      "height": 3072,
      "state": "open",
      "note": "分离的双足、黑色挂板与彩色夹杆；方位角为局部组件记录约定",
      "sha256": "ba784053c549112bc5753ea47e0e49b4e7d112e5dea81a58231b5f9eefcf5824"
    },
    {
      "id": "ref_1792834080100",
      "file": "新建文件夹/1792834080100.jpg",
      "kind": "detail",
      "azimuth": 180,
      "elevation": -70,
      "width": 3072,
      "height": 4096,
      "state": "open",
      "note": "躯干底面，角度估计",
      "sha256": "60f3718520f203bd2aa5788564c2b932a2ea13d2781ac400fba8c4e6fcf505c7"
    },
    {
      "id": "ref_1792834080134",
      "file": "新建文件夹/1792834080134.jpg",
      "kind": "interior",
      "azimuth": 135,
      "elevation": 20,
      "width": 3072,
      "height": 4096,
      "state": "open",
      "note": "拆下背面下部护板的侧凸点接口，角度估计",
      "sha256": "12ff57a5e7a17c054c49ccf283dacf003d17c78abfc23c60f411866418729963"
    },
    {
      "id": "ref_1792840634955",
      "file": "1792840634955.jpg",
      "kind": "detail",
      "azimuth": 0,
      "elevation": 0,
      "width": 3072,
      "height": 4096,
      "state": "open",
      "note": "新增双足夹杆近照；局部姿态不用于整机机位覆盖",
      "sha256": "dd59c3df7f1b607a5ed13cfe8673b74fd26ed76c0be048ff12807ed4b7cb4341"
    },
    {
      "id": "ref_1792840635011",
      "file": "1792840635011.jpg",
      "kind": "interior",
      "azimuth": 0,
      "elevation": 0,
      "width": 3072,
      "height": 4096,
      "state": "open",
      "note": "新增核心、侧凸点、独立翼片与顶部圆件底面；局部姿态不用于整机机位覆盖",
      "sha256": "2a0e51ec71b730958a022eb25bc659dfc1f7f51c265c8b3e35c092782badf32e"
    }
  ]
}
